{"schemaVersion":"clearcutt.catalog.evidence-manifest/v2","generatedAt":"2026-06-05T20:00:00Z","source":{"owner":"test-owner","repo":"test-repo","repoUrl":"https://github.com/test-owner/test-repo","registryBase":"ghcr.io/test-owner/test-repo"},"summary":{"imageReleases":2,"complete":2,"missingEvidence":0},"releases":[{"imageId":"java21-distroless","kind":"runtime","tag":"v1.0.0","publishedAt":"2026-06-05T20:00:00Z","isLatest":true,"fullName":"ghcr.io/test-owner/test-repo/clearcutt-java","imageRef":"ghcr.io/test-owner/test-repo/clearcutt-java:v1.0.0-distroless","immutableRef":"ghcr.io/test-owner/test-repo/clearcutt-java@sha256:1234567890abcdef1234567890abcdef1234567890abcdef1234567890abcdef","manifestDigest":"sha256:1234567890abcdef1234567890abcdef1234567890abcdef1234567890abcdef","channels":{"signature":{"expected":true,"observed":true,"status":"verified","source":"legacy-boolean","detail":"catalog release record reports Sigstore signature evidence"},"provenance":{"expected":true,"observed":true,"status":"verified","source":"legacy-boolean","detail":"catalog release record reports SLSA provenance evidence"},"sbom":{"expected":true,"observed":true,"status":"observed","source":"legacy-boolean","detail":"1/1 architecture SBOMs"},"tests":{"expected":true,"observed":true,"status":"verified","source":"legacy-boolean","detail":"1/1 passing test results"},"vulnerabilities":{"expected":true,"observed":true,"status":"observed","source":"legacy-boolean","detail":"1/1 vulnerability scans"},"exceptions":{"expected":false,"observed":false,"status":"not_applicable","detail":"no vulnerability exceptions recorded for this release"},"vex":{"expected":false,"observed":false,"status":"not_applicable","detail":"generate on demand with clearcutt vex java21-distroless --tag v1.0.0"}},"architectures":[{"arch":"amd64","os":"linux","imageDigest":"sha256:runtime-amd64","sbom":true,"tests":true,"vulnerabilities":true}],"signature":{"subject":"https://github.com/test-owner/test-repo/.github/workflows/release.yml@refs/heads/main","issuer":"https://token.actions.githubusercontent.com"},"provenance":{"predicateType":"https://slsa.dev/provenance/v1","builderId":"test-builder","slsaLevel":3},"assets":{"sbom":{"amd64":"https://example.invalid/java21-distroless-amd64.sbom.json"},"provenance":"https://example.invalid/java21-distroless.intoto.jsonl","testResults":{"amd64":"https://example.invalid/java21-distroless-amd64.test-results.json"},"digest":"https://example.invalid/java21-distroless.digest.json"},"catalogRecord":"images/java21-distroless.json"},{"imageId":"postgres16","kind":"service","tag":"v1.0.0","publishedAt":"2026-06-05T20:00:00Z","isLatest":true,"fullName":"ghcr.io/test-owner/test-repo/clearcutt-postgres16","imageRef":"ghcr.io/test-owner/test-repo/clearcutt-postgres16:v1.0.0","immutableRef":"ghcr.io/test-owner/test-repo/clearcutt-postgres16@sha256:abcdef1234567890abcdef1234567890abcdef1234567890abcdef1234567890","manifestDigest":"sha256:abcdef1234567890abcdef1234567890abcdef1234567890abcdef1234567890","channels":{"signature":{"expected":true,"observed":true,"status":"verified","source":"legacy-boolean","detail":"catalog release record reports Sigstore signature evidence"},"provenance":{"expected":true,"observed":true,"status":"verified","source":"legacy-boolean","detail":"catalog release record reports SLSA provenance evidence"},"sbom":{"expected":true,"observed":true,"status":"observed","source":"legacy-boolean","detail":"1/1 architecture SBOMs"},"tests":{"expected":true,"observed":true,"status":"verified","source":"legacy-boolean","detail":"1/1 passing test results"},"vulnerabilities":{"expected":true,"observed":true,"status":"observed","source":"legacy-boolean","detail":"1/1 vulnerability scans"},"exceptions":{"expected":false,"observed":false,"status":"not_applicable","detail":"no vulnerability exceptions recorded for this release"},"vex":{"expected":false,"observed":false,"status":"not_applicable","detail":"generate on demand with clearcutt vex postgres16 --tag v1.0.0"}},"architectures":[{"arch":"amd64","os":"linux","imageDigest":"sha256:postgres-amd64","sbom":true,"tests":true,"vulnerabilities":true}],"signature":{"subject":"https://github.com/test-owner/test-repo/.github/workflows/release.yml@refs/heads/main","issuer":"https://token.actions.githubusercontent.com"},"provenance":{"predicateType":"https://slsa.dev/provenance/v1","builderId":"test-builder","slsaLevel":3},"assets":{"sbom":{"amd64":"https://example.invalid/postgres16-amd64.sbom.json"},"provenance":"https://example.invalid/postgres16.intoto.jsonl","testResults":{"amd64":"https://example.invalid/postgres16-amd64.test-results.json"},"digest":"https://example.invalid/postgres16.digest.json"},"catalogRecord":"images/postgres16.json"}]}
